Call Identifier,Call or Text,Call/Text Date,Call/Text Time,Call Direction,Speaker 1,Speaker 2,Buildings Mentioned,Zone Names Mentioned,Device ID,Equipment Type,Issue Category,AI Classification,Upstream Trigger,Upstream Root Cause,Complexity,Knowledge Domain,Knowledge Assessment,Resolution Path,Resolution Data,Emotional Delta,Actionable Insight,Insight Match,Insight Count,Insight Details
CALL-001 at 2025-08-27 09-58-28.txt,Call,2025-08-27,09:58:28,Outbound,Support Rep,Installer (Customer A),Auto Parts Store - Location A,North furnace; South furnace,N/A,Furnace,Hardware Install Support,Installation onboarding,Support rep saw new device traffic on dashboard,Proactive post-install check-in; dashboard QR login bug,2,HVAC Installation; Dashboard Access,Mix,2,Device telemetry; firmware version; dashboard auth status,Neutral to Positive,Fix dashboard QR code login bug to eliminate installer confusion,No,0,
CALL-002 at 2025-08-27 14-52-27.txt,Call,2025-08-27,14:52:27,Inbound,Support Rep,Installer (Customer A),Auto Parts Store - Location A,Receiving,SCC459; CCTHR3100000401,Furnace; Rooftop Unit,Device Cellular Connectivity,Offline setup walkthrough,New device not connecting to cellular; screen went blank,Cellular dead zone in warehouse area,4,HVAC Installation; Cellular Connectivity; Offline Setup,Expert Judgment,3,Cellular signal status; hotspot SSID; device onboarding flow; 2.4GHz compatibility,Concerned to Satisfied,Pre-configure offline setup instructions for known low-signal warehouse locations,No,0,
CALL-003 at 2025-12-10 11-09-54.txt,Call,2025-12-10,11:09:54,Inbound,Facilities Manager (Customer B),Support Rep,Municipal Fire Station - Location B,Truck bay north front heater; Truck bay north rear heater; Truck bay south front heater,N/A,Unit Heater,Power Loss,Intermittent power loss,Intermittent power loss alarms on fire hall unit heaters,Manual light switch toggling cutting thermostat control power,4,HVAC Controls; Power Supply; Dashboard Navigation; Comfort Scheduling,Expert Judgment,3,Device power logs; zone naming config; comfort schedule settings; dashboard refresh behavior,Frustrated to Satisfied,Rename zones clearly and widen comfort ranges to reduce override and alarm frequency,Yes,7,2025-12-09 21:34 - Power Loss - Municipal Fire Station - Location B - Truck Bay north rear heater (1d before) | 2025-12-09 16:52 - Power Loss - Municipal Fire Station - Location B - Truck Bay north rear heater (1d before) | 2025-12-08 23:20 - Degradation - Municipal Fire Station - Location B - Bunkroom zone (2d before)
CALL-004 at 2026-03-09 11-21-20.txt,Call,2026-03-09,11:21:20,Inbound,Support Rep,Facilities Manager (Customer B),Municipal Fire Station - Location C,Basement AC only; Kitchen; Offices and bunk room,N/A,AC unit; Hydronic heating system,Malfunction,Equipment heating in cooling mode,Equipment malfunction notification triggered for basement AC,Basement AC unit producing heat instead of cooling; equipment mode misconfiguration on kitchen/office zones,5,HVAC Equipment Diagnostics; Equipment Configuration; Comfort Scheduling; Duct Layout,Expert Judgment,3,Equipment mode config; zone temperature trends; comfort schedule; equipment call history; duct layout,Confused to Satisfied,Review multi-zone equipment mode configurations during onboarding to ensure cooling/heating modes align with physical ductwork,No,0,
CALL-005 at 2026-01-21 13-18-50.txt,Call,2026-01-21,13:18:50,Outbound,Support Rep,Store Contact (Customer C),N/A (freezer location not specified),N/A,N/A,Freezer (walk-in),Comfort Settings,Freezer setpoint clarification,Customer emailed about adjusting freezer operating range,"Customer misunderstood monitoring-only sensor as controllable thermostat; dashboard ""coming soon"" feature caused confusion",1,Sensor Monitoring; Dashboard Features,Static Facts,1,Dashboard feature documentation; sensor vs. controller distinction,Neutral to Neutral,Clarify on dashboard UI that sensor-only zones cannot be controlled remotely to prevent customer confusion,No,0,
CALL-006 at 2025-10-27 16-44-04.txt,Call,2025-10-27,16:44:04,Inbound,Stationary Engineer (Customer D),Support Rep,Government Facilities - Location D,Office space,N/A,Heat pump with gas furnace backup,Power Loss,Device not powering on,Device showing no screen activity after being wired and powered on,Depleted internal battery from prolonged storage; possible 24V power supply issue at site,4,Device Power; Battery Diagnostics; Hardware Troubleshooting,Expert Judgment,3,Multimeter voltage reading; battery connector status; reset button response; RC/RH power verification,Concerned to Patient,Ship devices with fuller battery charge or include a pre-install power check step in documentation,No,0,
CALL-007 at 2026-02-25 13-55-25.txt,Call,2026-02-25,13:55:25,Outbound,Support Rep,Stationary Engineer (Customer E),"Public Library - Location E; Community Center - Location E","Computer area; Children's area; Large conference room; Senior wing",N/A,Heat pump; RTU,Device Cellular Connectivity,Cellular outage standby,Customer called about devices stuck in standby with no cellular; support rep returning call,Persistent cellular outages at multiple buildings causing devices to enter standby mode,5,Cellular Connectivity; HVAC Troubleshooting; Sensor Placement; Heat Pump Wiring,Expert Judgment,3,Cellular connectivity logs; device standby status; sensor zone assignment; wiring configuration (Y2 vs auxiliary heat),Frustrated to Hopeful,Investigate regional cellular outages and consider Wi-Fi fallback for chronic low-signal sites,Yes,25,2026-02-25 15:39 - Sensor Connection - No Device Power - Public Library - Location E - Computer area (0d before) | 2026-02-25 10:16 - Sensor Connection - No Device Power - Public Library - Location E - Meeting Rm/Hallway (0d before) | 2026-02-24 15:33 - Sensor Connection - Device Network Issue - Public Library - Location E - Computer area (1d before)
CALL-008 at 2026-03-24 14-11-54.txt,Call,2026-03-24,14:11:54,Inbound,Support Rep,Stationary Engineer (Customer D),Government Facilities - Location D,Office space,N/A,Heat pump with gas furnace backup,Wiring / Electrical,Wiring reference request,Customer on site ready to install but needs wiring guidance; support rep lacks prior photos,Previous wiring photos not accessible to new support rep; complex multi-cable heat pump wiring,3,HVAC Wiring; Heat Pump Configuration; Support Knowledge Transfer,Expert Judgment,3,Wiring photos (thermostat backplate + circuit board); previous case history; support email,Frustrated to Neutral,Ensure wiring photos and installation notes are stored in a shared CRM accessible to all support reps,No,0,
